1000, QB1, Ryan Fitzpatrick, BUF
1001, QB2, Tyler Thigpen, BUF
1002, RB1, Fred Jackson, BUF
1003, RB2, Corey Mcintyre, BUF
1004, RB3, C.J. Spiller, BUF
1005, RB4, Jehuu Caulcrick, BUF
1006, WR1, Roscoe Parrish, BUF
1007, WR2, Stevie Johnson, BUF
1008, WR3, Buster Davis, BUF
1009, WR4, Brad Smith, BUF
1010, TE1, David Martin, BUF
1011, TE2, Scott Chandler, BUF
1012, K, Rian Lindell, BUF
1013, QB1, Chad Henne, MIA
1014, QB2, Matt Moore, MIA
1015, RB1, Reggie Bush, MIA
1016, RB2, Davone Bess, MIA
1017, RB3, Daniel Thomas, MIA
1018, RB4, Lex Hilliard, MIA
1019, WR1, Brandon Marshall, MIA
1020, WR2, Brian Hartline, MIA
1021, WR3, Charles Clay, MIA
1022, WR4, Marlon Moore, MIA
1023, TE1, Anthony Fasano, MIA
1024, TE2, Mickey Shuler, MIA
1025, K, Dan Carpenter, MIA
1026, QB1, Tom Brady, NE
1027, QB2, Brian Hoyer, NE
1028, RB1, Danny Woodhead, NE
1029, RB2, Ben Green.Ellis, NE
1030, RB3, Stevan Ridley, NE
1031, RB4, Julian Edelman, NE
1032, WR1, Wes Welker, NE
1033, WR2, Chad Ochocinco, NE
1034, WR3, Deion Branch, NE
1035, WR4, Wr Patriots, NE
1036, TE1, Rob Gronkowski, NE
1037, TE2, Aaron Hernandez, NE
1038, K, Shayne Graham, NE
1039, QB1, Mark Sanchez, NYJ
1040, QB2, Mark Brunell, NYJ
1041, RB1, Shonn Greene, NYJ
1042, RB2, John Conner, NYJ
1043, RB3, L. Tomlinson, NYJ
1044, RB4, Joe Mcknight, NYJ
1045, WR1, Santonio Holmes, NYJ
1046, WR2, Plaxico Burress, NYJ
1047, WR3, Derrick Mason, NYJ
1048, WR4, Jeremy Kerley, NYJ
1049, TE1, Dustin Keller, NYJ
1050, TE2, M. Mulligan, NYJ
1051, K, Nick Folk, NYJ
1052, QB1, Andy Dalton, CIN
1053, QB2, Bruce Gradkowski, CIN
1054, RB1, Cedric Benson, CIN
1055, RB2, Brian Leonard, CIN
1056, RB3, Bernard Scott, CIN
1057, RB4, Chris Pressley, CIN
1058, WR1, Jerome Simpson, CIN
1059, WR2, Aj Green, CIN
1060, WR3, Andre Caldwell, CIN
1061, WR4, Jordan Shipley, CIN
1062, TE1, Jermaine Gresham, CIN
1063, TE2, Bo Scaife, CIN
1064, K, Mike Nugent, CIN
1065, QB1, Colt Mccoy, CLE
1066, QB2, Seneca Wallace, CLE
1067, RB1, Owen Marecic, CLE
1068, RB2, Peyton Hillis, CLE
1069, RB3, Montario Hardesty, CLE
1070, RB4, Armond Smtih, CLE
1071, WR1, M. Massaquoi, CLE
1072, WR2, Brian Robiskie, CLE
1073, WR3, Greg Little, CLE
1074, WR4, Josh Cribbs, CLE
1075, TE1, Ben Watson, CLE
1076, TE2, Evan Moore, CLE
1077, K, Phil Dawson, CLE
1078, QB1, Joe Flacco, BAL
1079, QB2, Tyrod Taylor, BAL
1080, RB1, Ray Rice, BAL
1081, RB2, Vonta Leach, BAL
1082, RB3, Ricky Williams, BAL
1083, RB4, Jalen Parmele, BAL
1084, WR1, Lee Evans, BAL
1085, WR2, Anquan Boldin, BAL
1086, WR3, Torrey Smith, BAL
1087, WR4, David Reed, BAL
1088, TE1, Ed Dickson, BAL
1089, TE2, Dennis Pitta, BAL
1090, K, Billy Cundiff, BAL
1091, QB1, B Roethlisberger, PIT
1092, QB2, Dennis Dixon, PIT
1093, RB1, Mewelde Moore, PIT
1094, RB2, R. Mendenhall, PIT
1095, RB3, Isaac Redman, PIT
1096, RB4, David Johnson, PIT
1097, WR1, Mike Wallace, PIT
1098, WR2, Hines Ward, PIT
1099, WR3, Emmanuel Sanders, PIT
1100, WR4, Antonio Brown, PIT
1101, TE1, Heath Miller, PIT
1102, TE2, John Gilmore, PIT
1103, K, Shaun Suisham, PIT
1104, QB1, Kerry Collins, IND
1105, QB2, Qb Colts, IND
1106, RB1, Joseph Addai, IND
1107, RB2, Austin Collie, IND
1108, RB3, Donald Brown, IND
1109, RB4, Delone Carter, IND
1110, WR1, Reggie Wayne, IND
1111, WR2, Pierre Garcon, IND
1112, WR3, Brody Eldridge, IND
1113, WR4, Anthony Gonzalez, IND
1114, TE1, Dallas Clark, IND
1115, TE2, Jacob Tamme, IND
1116, K, Adam Vinatieri, IND
1117, QB1, Matt Schaub, HOU
1118, QB2, Matt Leinart, HOU
1119, RB1, Lawrence Vickers, HOU
1120, RB2, Arian Foster, HOU
1121, RB3, Derrick Ward, HOU
1122, RB4, Ben Tate, HOU
1123, WR1, Kevin Walter, HOU
1124, WR2, Andre Johnson, HOU
1125, WR3, Jacoby Jones, HOU
1126, WR4, Dorin Dickerson, HOU
1127, TE1, Owen Daniels, HOU
1128, TE2, Joel Dreessen, HOU
1129, K, Neil Rackers, HOU
1130, QB1, Luke Mccown, JAX
1131, QB2, Blaine Gabbert, JAX
1132, RB1, M. Jones.Drew, JAX
1133, RB2, Greg Jones, JAX
1134, RB3, Rashad Jennings, JAX
1135, RB4, Montell Owens, JAX
1136, WR1, Jason Hill, JAX
1137, WR2, Mike Thomas, JAX
1138, WR3, Kassim Osgood, JAX
1139, WR4, Jarett Dillard, JAX
1140, TE1, Marcedes Lewis, JAX
1141, TE2, Zach Miller, JAX
1142, K, Josh Scobee, JAX
1143, QB1, Matt Hasselbeck, TEN
1144, QB2, Jake Locker, TEN
1145, RB1, Chris Johnson, TEN
1146, RB2, Ahmard Hall, TEN
1147, RB3, Javon Ringer, TEN
1148, RB4, Marc Mariani, TEN
1149, WR1, Kenny Britt, TEN
1150, WR2, Nate Washington, TEN
1151, WR3, Lavelle Hawkins, TEN
1152, WR4, Damian Williams, TEN
1153, TE1, Craig Stevens, TEN
1154, TE2, Jared Cook, TEN
1155, K, Rob Bironas, TEN
1156, QB1, Kyle Orton, DEN
1157, QB2, Brady Quinn, DEN
1158, RB1, Knowshon Moreno, DEN
1159, RB2, Willis Mcgahee, DEN
1160, RB3, Lance Ball, DEN
1161, RB4, Spencer Larsen, DEN
1162, WR1, Brandon Lloyd, DEN
1163, WR2, Eddie Royal, DEN
1164, WR3, D. Thomas, DEN
1165, WR4, Eric Decker, DEN
1166, TE1, Daniel Fells, DEN
1167, TE2, Julius Thomas, DEN
1168, K, Matt Prater, DEN
1169, QB1, Matt Cassel, KC
1170, QB2, Tyler Palko, KC
1171, RB1, Jamaal Charles, KC
1172, RB2, Leron Mcclain, KC
1173, RB3, Thomas Jones, KC
1174, RB4, Jackie Battle, KC
1175, WR1, Dwayne Bowe, KC
1176, WR2, Steve Breaston, KC
1177, WR3, Jonathan Baldwin, KC
1178, WR4, Dexter Mccluster, KC
1179, TE1, Leonard Pope, KC
1180, TE2, Jake Oconnell, KC
1181, K, Ryan Succop, KC
1182, QB1, Jason Campbell, OAK
1183, QB2, Kyle Boller, OAK
1184, RB1, Darren Mcfadden, OAK
1185, RB2, Marcel Reese, OAK
1186, RB3, Michael Bush, OAK
1187, RB4, Taiwan Jones, OAK
1188, WR1, Jacoby Ford, OAK
1189, WR2, Louis Murphy, OAK
1190, WR3, D. Heyward.Bey, OAK
1191, WR4, Denarius Moore, OAK
1192, TE1, Kevin Boss, OAK
1193, TE2, Brandon Myers, OAK
1194, K, S. Janikowski, OAK
1195, QB1, Philip Rivers, SD
1196, QB2, Billy Volek, SD
1197, RB1, Mike Tolbert, SD
1198, RB2, Ryan Mathews, SD
1199, RB3, Jordan Todman, SD
1200, RB4, Jacob Hester, SD
1201, WR1, Malcom Floyd, SD
1202, WR2, Vincent Jackson, SD
1203, WR3, Vincent Brown, SD
1204, WR4, Patrick Crayton, SD
1205, TE1, Antonio Gates, SD
1206, TE2, Randy Mcmichael, SD
1207, K, Nate Kaeding, SD
1208, QB1, Rex Grossman, WAS
1209, QB2, John Beck, WAS
1210, RB1, Tim Hightower, WAS
1211, RB2, Mike Sellers, WAS
1212, RB3, Roy Helu, WAS
1213, RB4, Ryan Torain, WAS
1214, WR1, Santana Moss, WAS
1215, WR2, Jabar Gaffney, WAS
1216, WR3, A. Armstrong, WAS
1217, WR4, L. Hankerson, WAS
1218, TE1, Chris Cooley, WAS
1219, TE2, Fred Davis, WAS
1220, K, Graham Gano, WAS
1221, QB1, Eli Manning, NYG
1222, QB2, David Carr, NYG
1223, RB1, Ahmad Bradshaw, NYG
1224, RB2, Brandon Jacobs, NYG
1225, RB3, Henry Hynoski, NYG
1226, RB4, Danny Ware, NYG
1227, WR1, Hakeem Nicks, NYG
1228, WR2, M. Manningham, NYG
1229, WR3, Jerrel Jernigan, NYG
1230, WR4, Victor Cruz, NYG
1231, TE1, Travis Beckum, NYG
1232, TE2, Bear Pascoe, NYG
1233, K, Lawrence Tynes, NYG
1234, QB1, Mike Vick, PHI
1235, QB2, Vince Young, PHI
1236, RB1, Lesean Mccoy, PHI
1237, RB2, Jason Avant, PHI
1238, RB3, Ronnie Brown, PHI
1239, RB4, Eldra Buckley, PHI
1240, WR1, Desean Jackson, PHI
1241, WR2, Jeremy Maclin, PHI
1242, WR3, Owen Schmitt, PHI
1243, WR4, Riley Cooper, PHI
1244, TE1, Brent Celek, PHI
1245, TE2, Clay Harbor, PHI
1246, K, Alex Henery, PHI
1247, QB1, Tony Romo, DAL
1248, QB2, Jon Kitna, DAL
1249, RB1, Felix Jones, DAL
1250, RB2, Kevin Ogletree, DAL
1251, RB3, Tashard Choice, DAL
1252, RB4, Demarco Murray, DAL
1253, WR1, Dez Bryant, DAL
1254, WR2, Miles Austin, DAL
1255, WR3, John Phillips, DAL
1256, WR4, Dwayne Harris, DAL
1257, TE1, Jason Witten, DAL
1258, TE2, M. Bennett, DAL
1259, K, Dan Bailey, DAL
1260, QB1, Jay Cutler, CHI
1261, QB2, Caleb Haine, CHI
1262, RB1, Matt Forte, CHI
1263, RB2, Johnny Knox, CHI
1264, RB3, Marion Barber, CHI
1265, RB4, Eddie Williams, CHI
1266, WR1, Roy Williams, CHI
1267, WR2, Devin Hester, CHI
1268, WR3, Will Ta.Ufo.Ou, CHI
1269, WR4, Earl Bennett, CHI
1270, TE1, Kellen Davis, CHI
1271, TE2, Matt Spaeth, CHI
1272, K, Robbie Gould, CHI
1273, QB1, Matt Stafford, DET
1274, QB2, Shaun Hill, DET
1275, RB1, Jahvid Best, DET
1276, RB2, Tony Scheffler, DET
1277, RB3, Maurice Morris, DET
1278, RB4, Aaron Brown, DET
1279, WR1, Nate Burleson, DET
1280, WR2, Calvin Johnson, DET
1281, WR3, Jerome Harrison, DET
1282, WR4, Titus Young, DET
1283, TE1, Brandon Pettigrew, DET
1284, TE2, Rashied Davis, DET
1285, K, Jason Hanson, DET
1286, QB1, Aaron Rodgers, GB
1287, QB2, Matt Flynn, GB
1288, RB1, John Kuhn, GB
1289, RB2, Ryan Grant, GB
1290, RB3, James Starks, GB
1291, RB4, Dimitri Nance, GB
1292, WR1, Greg Jennings, GB
1293, WR2, Donald Driver, GB
1294, WR3, Jordy Nelson, GB
1295, WR4, Randall Cobb, GB
1296, TE1, J. Finley, GB
1297, TE2, Andrew Quarles, GB
1298, K, Mason Crosby, GB
1299, QB1, Donovan Mcnabb, MIN
1300, QB2, Christian Ponder, MIN
1301, RB1, Adrian Peterson, MIN
1302, RB2, Bernard Berrian, MIN
1303, RB3, Toby Gerhart, MIN
1304, RB4, Lorenzo Booker, MIN
1305, WR1, Percy Harvin, MIN
1306, WR2, Michael Jenkins, MIN
1307, WR3, Ryan Dimperio, MIN
1308, WR4, Greg Camarillo, MIN
1309, TE1, V. Shiancoe, MIN
1310, TE2, Jim Kleinsasser, MIN
1311, K, Ryan Longwell, MIN
1312, QB1, Josh Freeman, TB
1313, QB2, Josh Johnson, TB
1314, RB1, Earnest Graham, TB
1315, RB2, L.G. Blount, TB
1316, RB3, Erik Lorig, TB
1317, RB4, Kregg Lumpkin, TB
1318, WR1, Mike Williams, TB
1319, WR2, Arrelious Benn, TB
1320, WR3, Sam Stroughter, TB
1321, WR4, Micheal Spurlock, TB
1322, TE1, Kellen Winslow, TB
1323, TE2, John Gilmore, TB
1324, K, Connor Barth, TB
1325, QB1, Drew Brees, NO
1326, QB2, Chase Daniel, NO
1327, RB1, Pierre Thomas, NO
1328, RB2, Mark Ingram, NO
1329, RB3, Darren Sproles, NO
1330, RB4, Korey Hall, NO
1331, WR1, Lance Moore, NO
1332, WR2, Marques Colston, NO
1333, WR3, Robert Meachem, NO
1334, WR4, Devery Henderson, NO
1335, TE1, Jimmy Graham, NO
1336, TE2, David Thomas, NO
1337, K, John Kasay, NO
1338, QB1, Matt Ryan, ATL
1339, QB2, Chris Redman, ATL
1340, RB1, Michael Turner, ATL
1341, RB2, Ovie Mughelli, ATL
1342, RB3, Jason Snelling, ATL
1343, RB4, Lucas Cox, ATL
1344, WR1, Roddy White, ATL
1345, WR2, Julio Jones, ATL
1346, WR3, Eric Weems, ATL
1347, WR4, Harry Douglas, ATL
1348, TE1, Tony Gonzalez, ATL
1349, TE2, Reggie Kelly, ATL
1350, K, Matt Bryant, ATL
1351, QB1, Cam Newton, CAR
1352, QB2, Derek Anderson, CAR
1353, RB1, D. Williams, CAR
1354, RB2, Jonathan Stewart, CAR
1355, RB3, Rashawn Jackson, CAR
1356, RB4, Tony Fiammetta, CAR
1357, WR1, Steve Smith, CAR
1358, WR2, Legadu Naanee, CAR
1359, WR3, Armanti Edwards, CAR
1360, WR4, Brandon Lafell, CAR
1361, TE1, Greg Olsen, CAR
1362, TE2, Jeremy Shockey, CAR
1363, K, Olindo Mare, CAR
1364, QB1, Alex Smith, SF
1365, QB2, C. Kaepernick, SF
1366, RB1, Frank Gore, SF
1367, RB2, Moran Norris, SF
1368, RB3, Anthony Dixon, SF
1369, RB4, Kendall Hunter, SF
1370, WR1, Josh Morgan, SF
1371, WR2, Braylon Edwards, SF
1372, WR3, Michael Crabtree, SF
1373, WR4, Ted Ginn, SF
1374, TE1, Vernon Davis, SF
1375, TE2, Delanie Walker, SF
1376, K, David Akers, SF
1377, QB1, Sam Bradford, STL
1378, QB2, A.J. Feeley, STL
1379, RB1, Steven Jackson, STL
1380, RB2, Brit Miller, STL
1381, RB3, Carnell Williams, STL
1382, RB4, Jerious Norwood, STL
1383, WR1, Mike Sims.Walker, STL
1384, WR2, Brandon Gibson, STL
1385, WR3, Danny Amendola, STL
1386, WR4, Donnie Avery, STL
1387, TE1, Billy Bajema, STL
1388, TE2, Lance Kendricks, STL
1389, K, Josh Brown, STL
1390, QB1, Tavaris Jackson, SEA
1391, QB2, C. Whitehurst, SEA
1392, RB1, Marshawn Lynch, SEA
1393, RB2, Golden Tate, SEA
1394, RB3, Justin Forsett, SEA
1395, RB4, Leon Washington, SEA
1396, WR1, Sidney Rice, SEA
1397, WR2, Mike Williams, SEA
1398, WR3, Deon Butler, SEA
1399, WR4, Ben Obomanu, SEA
1400, TE1, Zach Miller, SEA
1401, TE2, John Carlson, SEA
1402, K, Steve Hauschka, SEA
1403, QB1, Kevin Kolb, ARZ
1404, QB2, John Skelton, ARZ
1405, RB1, Beanie Wells, ARZ
1406, RB2, Larod Howling, ARZ
1407, RB3, Reagan Mauia, ARZ
1408, RB4, Anthony Sherman, ARZ
1409, WR1, Andre Roberts, ARZ
1410, WR2, Larry Fitzgerald, ARZ
1411, WR3, Early Doucet, ARZ
1412, WR4, S. Williams, ARZ
1413, TE1, Todd Heap, ARZ
1414, TE2, Jeff King, ARZ
1415, K, Jay Feely, ARZ
